{
  "schema": "comuvia/0.1",
  "record_type": "artifact_descriptor",
  "id": "review-calder-fees-edition-2",
  "revision": 1,
  "predecessor": null,
  "data_origin": "synthetic",
  "content": {
    "media_type": "application/json",
    "byte_length": 1020,
    "digest": "sha256:1e313dbf007617315bd38a8a601566b5e50c435b9679c077c3996f585112476c"
  },
  "content_schema": "edition-review/1",
  "origin": {
    "name": "Example edition review workflow (fictional)",
    "locator": "https://example.org/synthetic/port-calder/"
  },
  "published_at": {
    "unknown": "not_published",
    "note": "internal example artifact"
  },
  "retrieved_at": "2027-02-05T09:00:00Z",
  "units": {
    "unknown": "not_applicable",
    "note": "holds no data values"
  },
  "rights_reference": "Original synthetic example content; Apache-2.0 with this repository.",
  "access": "private",
  "locator": "urn:example:port-calder:review-calder-fees-edition-2:r1",
  "extensions": {
    "org.comuvia.dependencies/v1": {
      "value_origin": "none",
      "meaning": {
        "measure": {
          "unknown": "not_applicable",
          "note": "holds no data values"
        },
        "unit": {
          "unknown": "not_applicable",
          "note": "holds no data values"
        },
        "period": {
          "unknown": "not_applicable",
          "note": "holds no data values"
        },
        "geography": {
          "unknown": "not_applicable",
          "note": "holds no data values"
        }
      },
      "coverage": "complete",
      "depends_on": []
    }
  },
  "recorded_by": "recorder:example-edition-review",
  "recorded_at": "2027-02-05T09:00:00Z"
}
