{
  "schema": "comuvia/0.1",
  "record_type": "artifact_descriptor",
  "id": "contribution-calder-fees-draft",
  "revision": 1,
  "predecessor": null,
  "data_origin": "synthetic",
  "content": {
    "media_type": "application/json",
    "byte_length": 585,
    "digest": "sha256:19c2701ce5bde0570066c34e102f5ce5c0e0566b50616fd8993053c33faa8c55"
  },
  "content_schema": "contribution/1",
  "origin": {
    "name": "Example edition review workflow (fictional)",
    "locator": "https://example.org/synthetic/port-calder/"
  },
  "published_at": {
    "unknown": "not_published",
    "note": "internal example artifact"
  },
  "retrieved_at": "2027-02-01T10:00:00Z",
  "units": {
    "unknown": "not_applicable",
    "note": "holds no data values"
  },
  "rights_reference": "Original synthetic example content; Apache-2.0 with this repository.",
  "access": "private",
  "locator": "urn:example:port-calder:contribution-calder-fees-draft:r1",
  "extensions": {
    "org.comuvia.dependencies/v1": {
      "value_origin": "none",
      "meaning": {
        "measure": {
          "unknown": "not_applicable",
          "note": "holds no data values"
        },
        "unit": {
          "unknown": "not_applicable",
          "note": "holds no data values"
        },
        "period": {
          "unknown": "not_applicable",
          "note": "holds no data values"
        },
        "geography": {
          "unknown": "not_applicable",
          "note": "holds no data values"
        }
      },
      "coverage": "complete",
      "depends_on": []
    }
  },
  "recorded_by": "recorder:example-edition-review",
  "recorded_at": "2027-02-01T10:00:00Z"
}
