{
  "schema": "comuvia/0.1",
  "record_type": "artifact_descriptor",
  "id": "model-calder-stress",
  "revision": 1,
  "predecessor": null,
  "data_origin": "synthetic",
  "content": {
    "media_type": "application/json",
    "byte_length": 111,
    "digest": "sha256:c1c30fc6c2a6836a5efa68c3a648d52e9520821e03173bfe3be908db34bd4b48"
  },
  "content_schema": "example-stress-model/1",
  "origin": {
    "name": "Example dependency workflow (fictional)",
    "locator": "https://example.org/synthetic/port-calder/"
  },
  "published_at": {
    "unknown": "not_published",
    "note": "internal example artifact"
  },
  "retrieved_at": "2027-01-20T10:00:00Z",
  "units": {
    "unknown": "not_applicable",
    "note": "holds no data values"
  },
  "rights_reference": "Original synthetic example content; Apache-2.0 with this repository.",
  "access": "private",
  "locator": "urn:example:port-calder:model-calder-stress:r1",
  "extensions": {
    "org.comuvia.dependencies/v1": {
      "value_origin": "none",
      "meaning": {
        "measure": {
          "unknown": "not_applicable",
          "note": "holds no data values"
        },
        "unit": {
          "unknown": "not_applicable",
          "note": "holds no data values"
        },
        "period": {
          "unknown": "not_applicable",
          "note": "holds no data values"
        },
        "geography": {
          "unknown": "not_applicable",
          "note": "holds no data values"
        }
      },
      "coverage": "complete",
      "depends_on": []
    }
  },
  "recorded_by": "recorder:example-dependencies",
  "recorded_at": "2027-01-20T10:00:00Z"
}
