{
  "schema": "comuvia/0.1",
  "record_type": "artifact_descriptor",
  "id": "protocol-calder-nowcast",
  "revision": 1,
  "predecessor": null,
  "data_origin": "synthetic",
  "content": {
    "media_type": "application/json",
    "byte_length": 436,
    "digest": "sha256:1fbbac2834ad3e46e51c7a6ea27bf3d10615c89e3c4955533f14240332e2220f"
  },
  "content_schema": "example-protocol/1",
  "origin": {
    "name": "Example pinned evaluation (fictional)",
    "locator": "https://example.org/synthetic/calder/"
  },
  "published_at": {
    "unknown": "not_published",
    "note": "internal example artifact"
  },
  "retrieved_at": "2027-05-02T10:00:00Z",
  "units": {
    "unknown": "not_applicable",
    "note": "holds no data values"
  },
  "rights_reference": "Original synthetic example content; Apache-2.0 with this repository.",
  "access": "private",
  "locator": "urn:example:calder:protocol-calder-nowcast:r1",
  "extensions": {
    "org.comuvia.dependencies/v1": {
      "value_origin": "none",
      "meaning": {
        "measure": {
          "unknown": "not_applicable",
          "note": "holds no data values"
        },
        "unit": {
          "unknown": "not_applicable",
          "note": "holds no data values"
        },
        "period": {
          "unknown": "not_applicable",
          "note": "holds no data values"
        },
        "geography": {
          "unknown": "not_applicable",
          "note": "holds no data values"
        }
      },
      "coverage": "complete",
      "depends_on": []
    }
  },
  "recorded_by": "recorder:example-pinned-evaluation",
  "recorded_at": "2027-05-02T10:00:00Z"
}
